{"id":"REG-MES-001","type":"region","title":"Mesopotamia","status":"active","version":"1.0.0","description":"The Tigris-Euphrates river system and surrounding regions of ancient southwestern Asia.","geographic_scope":"Tigris-Euphrates basin and adjacent ancient cultural zones","civilization_ids":["CIV-MES-001"],"source_ids":[],"notes":"Modern political boundaries are not implied."}