{"id":"REG-NIL-001","type":"region","title":"Nile Valley","status":"active","version":"1.0.0","description":"The Nile river corridor and its surrounding floodplain and delta environments in northeastern Africa.","geographic_scope":"Nile Valley and Delta","civilization_ids":["CIV-EGY-001"],"source_ids":[],"notes":"Geographic boundaries are intentionally broad in this starter record."}