{"id":"REG-LEV-001","type":"region","title":"Levant","status":"active","version":"1.0.0","description":"Broad geographic designation for the eastern Mediterranean lands relevant to the historical study of the Hebrew Bible and neighboring cultures.","geographic_scope":"Eastern Mediterranean coastal and inland Levant","civilization_ids":[],"source_ids":[],"notes":"This is a geographic taxonomy node, not a claim about a single ancient political entity."}