{"id":"REG-AEG-001","type":"region","title":"Aegean and Greek World","status":"active","version":"1.0.0","description":"The Aegean basin and regions associated with ancient Greek-speaking communities and cultural networks.","geographic_scope":"Aegean Sea, mainland Greece, islands, and wider Greek cultural sphere","civilization_ids":["CIV-GRC-001"],"source_ids":[],"notes":"The geographic extent of the Greek world changed across periods."}